{
  "schema_version": "0.1.0-draft",
  "case_id": "sp_chest_02",
  "case_version": "0.1.0-draft",
  "synthetic": true,
  "review": {
    "status": "DRAFT",
    "reviewer": null,
    "reviewed_at": null,
    "approval_reference": null,
    "needs_medical_teacher": true
  },
  "notice": "仅用于教学训练；不用于诊断、治疗、分诊或替代执业人员判断。病例及量表尚需医学教师审核。",
  "title": "吸气时局部刺痛（合成草案）",
  "chief_complaint": "胸痛",
  "facts": [
    {
      "fact_id": "fact.identity",
      "slot": "identity",
      "value": "31岁，合成人物乙"
    },
    {
      "fact_id": "fact.onset",
      "slot": "onset",
      "value": "昨天晚上开始，能记清刚出现的时间"
    },
    {
      "fact_id": "fact.location",
      "slot": "location",
      "value": "右侧胸口一小块地方"
    },
    {
      "fact_id": "fact.quality",
      "slot": "quality",
      "value": "一阵一阵像针扎"
    },
    {
      "fact_id": "fact.severity",
      "slot": "severity",
      "value": "自己估计四分，满分十分"
    },
    {
      "fact_id": "fact.duration",
      "slot": "duration",
      "value": "每阵不到一分钟，今天多次"
    },
    {
      "fact_id": "fact.radiation",
      "slot": "radiation",
      "value": "没感觉到其他地方也痛"
    },
    {
      "fact_id": "fact.provocation",
      "slot": "provocation",
      "value": "深吸气和咳嗽时明显"
    },
    {
      "fact_id": "fact.relief",
      "slot": "relief",
      "value": "安静坐着、不深吸气时轻些"
    },
    {
      "fact_id": "fact.associated",
      "slot": "associated",
      "value": "有干咳；没有出汗，也没有自觉发热"
    },
    {
      "fact_id": "fact.background",
      "slot": "background",
      "value": "没记得长期疾病；没有长期用药；药物过敏情况不清楚；不吸烟；家里类似情况不清楚"
    },
    {
      "fact_id": "fact.timeline",
      "slot": "timeline",
      "value": "昨晚到今天感觉差不多"
    },
    {
      "fact_id": "fact.previous_episode",
      "slot": "previous_episode",
      "value": "以前没出现过这种感觉"
    },
    {
      "fact_id": "fact.care_received",
      "slot": "care_received",
      "value": "这次没有检查或自行服药"
    },
    {
      "fact_id": "fact.concern",
      "slot": "concern",
      "value": "担心疼痛会持续"
    }
  ],
  "unknowns": [
    {
      "fact_id": "unknown.diagnosis",
      "slot": "diagnosis",
      "value": null,
      "reason": "合成设定未提供；不推断阴性或正常结果"
    },
    {
      "fact_id": "unknown.ecg",
      "slot": "ecg",
      "value": null,
      "reason": "合成设定未提供；不推断阴性或正常结果"
    },
    {
      "fact_id": "unknown.troponin",
      "slot": "troponin",
      "value": null,
      "reason": "合成设定未提供；不推断阴性或正常结果"
    },
    {
      "fact_id": "unknown.vital_signs",
      "slot": "vital_signs",
      "value": null,
      "reason": "合成设定未提供；不推断阴性或正常结果"
    },
    {
      "fact_id": "unknown.drug_dose",
      "slot": "drug_dose",
      "value": null,
      "reason": "合成设定未提供；不推断阴性或正常结果"
    },
    {
      "fact_id": "unknown.contact_details",
      "slot": "contact_details",
      "value": null,
      "reason": "合成设定未提供；不推断阴性或正常结果"
    }
  ],
  "disclosure_rules": [
    {
      "fact_id": "fact.identity",
      "trigger_intents": [
        "ask.identity"
      ],
      "requires_all_disclosed": []
    },
    {
      "fact_id": "fact.onset",
      "trigger_intents": [
        "ask.onset"
      ],
      "requires_all_disclosed": []
    },
    {
      "fact_id": "fact.location",
      "trigger_intents": [
        "ask.location"
      ],
      "requires_all_disclosed": []
    },
    {
      "fact_id": "fact.quality",
      "trigger_intents": [
        "ask.quality"
      ],
      "requires_all_disclosed": []
    },
    {
      "fact_id": "fact.severity",
      "trigger_intents": [
        "ask.severity"
      ],
      "requires_all_disclosed": []
    },
    {
      "fact_id": "fact.duration",
      "trigger_intents": [
        "ask.duration"
      ],
      "requires_all_disclosed": []
    },
    {
      "fact_id": "fact.radiation",
      "trigger_intents": [
        "ask.radiation"
      ],
      "requires_all_disclosed": []
    },
    {
      "fact_id": "fact.provocation",
      "trigger_intents": [
        "ask.provocation"
      ],
      "requires_all_disclosed": []
    },
    {
      "fact_id": "fact.relief",
      "trigger_intents": [
        "ask.relief"
      ],
      "requires_all_disclosed": []
    },
    {
      "fact_id": "fact.associated",
      "trigger_intents": [
        "ask.associated"
      ],
      "requires_all_disclosed": []
    },
    {
      "fact_id": "fact.background",
      "trigger_intents": [
        "ask.background"
      ],
      "requires_all_disclosed": []
    },
    {
      "fact_id": "fact.timeline",
      "trigger_intents": [
        "observe.clarify_timeline"
      ],
      "requires_all_disclosed": []
    },
    {
      "fact_id": "fact.previous_episode",
      "trigger_intents": [
        "ask.previous_episode"
      ],
      "requires_all_disclosed": []
    },
    {
      "fact_id": "fact.care_received",
      "trigger_intents": [
        "ask.care_received"
      ],
      "requires_all_disclosed": []
    },
    {
      "fact_id": "fact.concern",
      "trigger_intents": [
        "ask.concern"
      ],
      "requires_all_disclosed": []
    },
    {
      "fact_id": "unknown.diagnosis",
      "trigger_intents": [
        "ask.diagnosis"
      ],
      "requires_all_disclosed": []
    },
    {
      "fact_id": "unknown.ecg",
      "trigger_intents": [
        "ask.ecg"
      ],
      "requires_all_disclosed": []
    },
    {
      "fact_id": "unknown.troponin",
      "trigger_intents": [
        "ask.troponin"
      ],
      "requires_all_disclosed": []
    },
    {
      "fact_id": "unknown.vital_signs",
      "trigger_intents": [
        "ask.vital_signs"
      ],
      "requires_all_disclosed": []
    },
    {
      "fact_id": "unknown.drug_dose",
      "trigger_intents": [
        "ask.drug_dose"
      ],
      "requires_all_disclosed": []
    },
    {
      "fact_id": "unknown.contact_details",
      "trigger_intents": [
        "ask.contact_details"
      ],
      "requires_all_disclosed": []
    }
  ],
  "role_policy": {
    "answer_only_asked": true,
    "unknown_answer": "这项我不清楚，设定里没有提供。",
    "diagnostic_inference": false,
    "assessment_hints": false,
    "teaching_hints": "slot_labels_only"
  },
  "rubric_ref": "chest_pain_history_draft",
  "rubric_version": "0.1.0-draft",
  "teacher_only": {
    "diagnosis": null,
    "review_questions": [
      "合成病史是否自洽、适合指定教学层级？",
      "哪些追问和表述应改写？",
      "哪些未知信息需要补充，哪些应继续保留未知？"
    ]
  }
}
